id,user_id,title,content,like_count,created_at,updated_at
170,10,Review from JPV852,"Fun sci-fi fantasy that features a solid cast, good visual effects and okay enough story. Not great but well worth the price of admission. That said, can't say I have a desire to revisit for a long while. **3.75/5**",785,2025-07-25 19:32:49,2025-07-25 19:32:49
171,68,Review from Simon Foster,"""Unlike the last dozen-or-so MCU plods, which turned derring-do comic book heroics into endurance tests, THE FANTASTIC FOUR: FIRST STEPS spins a ripping yarn that soars not only on spectacle, but also smarts and sentiment...""
Read the full review here: https://bit.ly/4o5P6rP",48,2025-07-26 03:48:26,2025-07-26 03:48:26
172,6,Review from CinemaSerf,"Well good news, after ages and having given up trying “Sue” (Vanessa Kirby) and boffin “Reed” (Pedro Pascal) are going to have a bairn! This is great news for her brother “Johnny” (Joseph Quinn) and the stony fourth member of their gang “Ben” (Egon Moss-Bacharach). The news is greeted enthusiastically by their adoring fans too, but those celebrations are cut short when a mysterious woman descends from what looks like a meteor shower to forewarn them that their planet is doomed. Her (Julia Garner) boss “Galactus” (Ralph Ineson) is on his way, and he is hungry for not just some rare earths, but all of it! Blessed with their array of super-powers, the quartet embark in their warp-capable rocket to meet this chap and he offers them an alternative to global destruction. It’s one hell of a sacrifice for the would-be parents though, but with the fate of humanity hanging on their decision - what will they choose? Perhaps they can think of a scientific alternative? There is a slightly retro-look to the production, with their flying car looking like a converted Citroën that belonged in a Jacques Tati film, and there is plenty of inter-galactic adventure with some effective visual effects, a decent degree of menace and it stays sufficiently devoid of sentiment, and the multiverse, until the denouement. Though they do gel well together, none of the acting isn’t really anything special, nor is the writing, but “Ben” looks good with his beard and Quinn probably steals the show with his engagingly flaming character and his spray-on white 501s. There are loads of gadgets and gizmos and anyone who has ever had to argue with a child seat and a car might empathise, too. It’s an old-fashioned save the world movie that hasn’t sold it’s soul to the CGI, and I enjoyed it.",664,2025-07-26 15:25:48,2025-07-26 15:29:05
173,28,Review from Chris Sawin,"Much of The Fantastic Four: First Steps is built around Reed Richards (Pedro Pascal) and Sue Storm (Vanessa Kirby) getting pregnant and having their child, Franklin. Everything seems to be built around baby proofing and preparing for someone new to enter their lives until The Silver Surfer (Julia Garner) arrives to let everyone know that an enormous cosmic being named Galactus plans to swing by and eat the entire planet. 

The superhero film feels like a sci-fi film from the 1960s, which makes sense since Fantastic Four #1 debuted in 1961. Maybe it’s the bright colors or the fact that H.E.R.B.I.E. is featured so prominently, but the first half of the film feels like a multi-episode arc of The Jetsons.

Things are lighthearted and fairly silly until The Silver Surfer shows up. But The Fantastic Four and James Gunn’s Superman seem to be honoring the silver age of comic books, which is a welcome change for superhero films.  

Oddly, the marketing makes it seem like the family bond amongst The Fantastic Four is so strong because it doesn’t seem that great while watching it. The film isn’t an origin story, as you only get a brief montage of how they got their powers. But there’s a lot of indecisiveness amongst the team with Franklin on the way. The way time passes in the film is weird. Sue’s pregnancy and Franklin’s age (apart from a certain time jump) seem accelerated, and it’s difficult to decipher if that much time has passed (nine months for the pregnancy, plus however many additional months Franklin is supposed to be) or if it’s fast-tracked because they all have powers.

The casting in The Fantastic Four: First Steps is fine, but they still seem to be finding a rhythm as a team. Reed’s brain works in a way that has him thinking of the worst scenarios, while his plans and logic stem from building everything around the most horrible solution. Sue just wants her baby to thrive in the presence of a loving family. She doesn’t want to give him to Galactus or decide his fate if he happens to have powers. She wants him to live and flourish with his own identity and choices.

The film seems to hint at Johnny being a womanizer, but he’s painfully single here. He latches onto The Silver Surfer and devotes a good chunk of the film to learning her language just so he can talk to her. The fate of the world may be at stake, sure, but dat silver ass has light years to travel and he’s got to make his moves now.

Ben is kinda boring, honestly. He shows interest in Rachel Rozman (Natasha Lyonne) and returning to the places that remind him of what it’s like to feel normal, but unless he’s destroying something or lifting a car over his head, he’s a little forgettable. He isn’t conflicted enough and doesn’t clobber enough things to leave a lasting impression.

Reed and Sue have noticeable chemistry, and they should given that they’re married. And Johnny and Ben have this macho kind of bro energy where they’re always ribbing each other and yet also sarcastically supporting one another (Ben’s beard, Johnny referring to himself in third person). As a foursome and a team, though, they still seem to be lacking, like they’re still learning to coordinate cohesively instead of Reed or Sue calling it on the spot.

The film takes place four years after the cosmic storm that caused them to gain their powers. But maybe the “first steps” part of the title refers to them still learning to work together as a team, as well as Franklin’s first baby steps.

The visual effects are mostly extremely impressive, with a few noticeable green screen shots and face animations being the only funky inclusions. The Silver Surfer’s face looks awkward at times, like it isn’t properly centered on Julia Garner’s body, or something. I wasn’t a huge fan of how the Human Torch looked either. His body is just orange with some lazy flames at the sides that don’t even cover his entire body.

The Silver Surfer chase sequences in the wormhole are some of the best the MCU has ever done. There was a bit of an uproar amongst the internet community when The Silver Surfer turned out to be female in this, but the character is given the coolest moments in the film and arguably the film’s most emotional sequence apart from the film’s finale. It's been apparent since Doctor Strange has been hinting at it in both of his films, but the MCU needs to go fully cosmic for its next phase.

Despite being beloved around the world and being a team for a decent amount of time, it feels like The Fantastic Four are still working out the kinks of being a solid team in First Steps. The performances are solid, the chemistry amongst the cast is great, and there are sentimental moments sprinkled throughout the entire film. 

There’s a lot of promise in what the future of the MCU holds with this version of The Fantastic Four, and it’s somewhat of a relief to have a Fantastic Four film that is actually worthwhile and hopefully worth revisiting with fondness instead of regret.",691,2025-07-26 22:32:41,2025-07-26 22:32:41
174,86,Review from abednegojs,"I like drama, but i don't like action",198,2025-07-29 04:16:18,2025-08-29 22:17:19
175,43,Review from dumasori,"**Not bad!!**

Because of the crap Marvel has been pumping overt the last decade, I went to watch this movie with very low hopes.

It was a surprising experience that the movie turned out to be pretty OK. Storyline is not too complicated. It is a simple predictable story without too much twisted plots or surprises. Nonetheless, the storytelling is captivating and you don’t realize how the 1:30 hr passed. Acting is pretty decent, Pedro Pascal shines in his acting. There is no typical Marvel BS in this movie.

If I had seen this movie about 15 years ago, I would have called it an average. But I am so sick and fatigued with crap movies these days, that even a normal movie like this feels good.

Overall it is worth watching.",608,2025-08-06 04:31:17,2025-08-06 04:34:29
176,87,Review from Louisa Moore - Screen Zealots,"There’s a distinctive charm to “The Fantastic Four: First Steps,” a refreshing, visually inventive take on the MCU formula. Director Matt Shakman brings Marvel’s First Family into a retro-futuristic 1960s setting that makes the movie stand out from the typical summer superhero fare. Shakman delivers a world of bold colors, bubble-helmeted scientists, and sleek, sci-fi tech that’s unexpectedly delightful, if a bit slow moving.

Reed Richards (Pedro Pascal) and his wife Sue Storm (Vanessa Kirby) have their first baby on the way. They, along with Reed’s brother-in-law Johnny (Joseph Quinn) and best friend Ben (Ebon Moss-Bachrach), are excited to welcome a new bundle of joy into their home. But when a mysterious woman known as Silver Surfer (Julia Garner) shows up with a dire warning from a ravenous space god called Galactus (Ralph Ineson), Sue and Reed are given an impossible choice: give up their newborn son to save Earth, or let the entire planet be destroyed. 

This conflict sounds compelling, but it’s also where the film stumbles. Galactus is more of a looming concept than a compelling villain, with motivations that feel too impersonal and very vague. Silver Surfer is a terrific character with an interesting back story, but the movie never quite gives her enough to do. The Four aren’t bogged down with an elaborate origin story either, and it works well here. They’re already established by the time we meet them, which allows for more time spent on character dynamics. I could see how casual audiences who are less familiar with the comic book characters could find the lack of an origin story disappointing, but the actors and their chemistry more than make up for it. 

The film leans into its “found family” theme with heart and sincerity, placing an emphasis on character over spectacle. The strong performances from the cast boost the film’s overall credibility, and the special effects are (admittedly) top notch. The themes lean heavily on the idea that family is not only biological, but also can be chosen, and there’s a nice balance between the need to be superheroes as well as parents and a strongly bonded family.

Although there is plenty to like here, “The Fantastic Four: First Steps” isn’t a movie I’d ever want to revisit. I can’t honestly say that I’m excited to see any of these characters in future films, and I actually found the Four to be a little bit boring. And while it’s so nice to see a Marvel film that isn’t trying desperately to be forcefully stuffed into some extended universe timeline, the movie doesn’t entirely escape the studio’s usual pitfalls.

By: Louisa Moore / SCREEN ZEALOTS",925,2025-08-09 20:42:45,2025-08-09 20:42:45
177,87,Review from Louisa Moore - Screen Zealots,"There’s a distinctive charm to “The Fantastic Four: First Steps,” a refreshing, visually inventive take on the MCU formula. Director Matt Shakman brings Marvel’s First Family into a retro-futuristic 1960s setting that makes the movie stand out from the typical summer superhero fare. Shakman delivers a world of bold colors, bubble-helmeted scientists, and sleek, sci-fi tech that’s unexpectedly delightful, if a bit slow moving.

Reed Richards (Pedro Pascal) and his wife Sue Storm (Vanessa Kirby) have their first baby on the way. They, along with Reed’s brother-in-law Johnny (Joseph Quinn) and best friend Ben (Ebon Moss-Bachrach), are excited to welcome a new bundle of joy into their home. But when a mysterious woman known as Silver Surfer (Julia Garner) shows up with a dire warning from a ravenous space god called Galactus (Ralph Ineson), Sue and Reed are given an impossible choice: give up their newborn son to save Earth, or let the entire planet be destroyed. 

This conflict sounds compelling, but it’s also where the film stumbles. Galactus is more of a looming concept than a compelling villain, with motivations that feel too impersonal and very vague. Silver Surfer is a terrific character with an interesting back story, but the movie never quite gives her enough to do. The Four aren’t bogged down with an elaborate origin story either, and it works well here. They’re already established by the time we meet them, which allows for more time spent on character dynamics. I could see how casual audiences who are less familiar with the comic book characters could find the lack of an origin story disappointing, but the actors and their chemistry more than make up for it. 

The film leans into its “found family” theme with heart and sincerity, placing an emphasis on character over spectacle. The strong performances from the cast boost the film’s overall credibility, and the special effects are (admittedly) top notch. The themes lean heavily on the idea that family is not only biological, but also can be chosen, and there’s a nice balance between the need to be superheroes as well as parents and a strongly bonded family.

Although there is plenty to like here, “The Fantastic Four: First Steps” isn’t a movie I’d ever want to revisit. I can’t honestly say that I’m excited to see any of these characters in future films, and I actually found the Four to be a little bit boring. And while it’s so nice to see a Marvel film that isn’t trying desperately to be forcefully stuffed into some extended universe timeline, the movie doesn’t entirely escape the studio’s usual pitfalls.

By: Louisa Moore / SCREEN ZEALOTS",605,2025-08-09 20:43:06,2025-08-09 20:43:07
178,88,Review from bloucks,Look I am a huge Marval Movie fan and I thought this movie was one of my favorite movies of 2025 and one of my favorite Marvel Movies ever!,564,2025-10-08 15:26:12,2025-10-08 23:09:14
179,89,Review from tmdb87069603,"With a movie like this you wonder how all of the otherwise, main characters will work together and support the story.

No problems here.  While as might be expected, R. Downey Jr. comes across largely central, it is still a good mix and IMHO the best scenes in the movie involve the generated Hulk character.

With that kind of successful melding of characters, Hollywood-scale egos and even computer generated characters; you have to give it up to the writers and director to make this the successful film that it is.",255,2012-06-05 23:00:24,2021-06-23 15:57:15
180,60,Review from Gimly,"**A long format review from 2012**

My new favourite Marvel Cinematic Universe film, undoubtedly! Order goes thusly;

1. The Avengers
2. Iron Man
3. Thor
4. Captain America
5. Iron Man 2
6. The Incredible Hulk

I had the privilege of going to Sydney and watching this almost a full three weeks before it’s American release, in a special advance screening for fans and a handful of critics. I drove up and back on a day trip with my mate HRV, spent over $400 between us… So worth it.

I think perhaps my expectations of The Avengers were too high. In fact I know they were, even so, I feel that it almost managed to meet them. All but two of the fears I had about this epic were quashed without a doubt. I initially was worried about Mark Ruffalo helming the role of The Hulk/Bruce Banner after taking over from Edward Norton who was ousted after his first appearance. My complaints were completely unfounded however, as Mark Ruffalo presents us with an at least as good Marvel Hero. 

In terms of entertainment, The Avengers is one of the greatest feats ever produced. At the screening I went to, I actually missed more than a couple of lines due to the fact that the entire bloody cinema was in hysterics from some classic Joss Whedon (Director - Buffy, Angel, Firefly, Dollhouse) humour. The squabbles between these larger than life characters are not quite up to the peak that Jon Favreau’s Iron Man & Iron Man 2 sit on, but in terms of film in general, they are some of the better interactions I’ve ever seen.

The only weak points I really have to whinge about are both quite minor, and perhaps can be rectified in the MCU future. Firstly, Thor’s return to Earth (whilst brilliantly dramatic and pretty) was quite weak in terms of exposition. That said, this isn’t a Thor movie, so we don’t need to know everything that happens to him. Also, in next year’s Thor 2, it is very possible we’ll discover more specific details about the first few scenes of his return. Secondly, Loki’s army also came across to me quite weakly. In case we have any Marvel aficionados in the crowd, I won’t spoil it by telling you who they’re supposed to be, but in general the whole army was essentially a meat shield used to bump out scenes in which The Avengers get to kick ass. A very enjoyable part of the film, but one that doesn’t really drive the story at all.

I feel the only way I can adequately describe just how much you need to see this movie (in cinemas) is this: For those of you who understand me, you will be know and be aware of just how much I fucking hate the concept of Blu-Ray. I am going to buy a Blu-Ray player, a HD television, and Blu-Ray discs, just so that I will get more special features when The Avengers is released. Never have I even considered doing such a thing before.

The Avengers doesn’t get into your mind and rape it in the best way possible like Revolver or Donnie Darko. It doesn’t get into your guts and turn them with nostalgic violence like the brilliance in Doomsday or Outpost. It gets into your heart, and leaves you not just wanting, but needing more. Long live the MCU!

90%

-Gimly",535,2017-10-27 02:47:35,2021-06-23 15:58:02
181,61,Review from Per Gunnar Jonsson,"After the recent disappointments from Marvel, notably Thor and the abysmal second instalment of Ghost Rider, this was a pleasant experience.

The special effects are dazzling, the plot is acceptable and the heroes are not making total idiots out of themselves just because the director wanted some “depth” to their characters. Sure there is a little bickering in between them but not too much to distract from the fun.

I’ve always liked Robert Downey Jr’s portrayal of Tony Stark and his sharp tongue. I did wonder how they where going to get the Hulk in there since he’s supposed to be uncontrollable but they did it. Okay they downplayed his uncontrollability a bit but I can live with that. I absolutely loved the “puny god” scene (if you haven’t seen the film yet you’ll have to see it to know what I mean, I wont spoil it in advance).

I have to say that I found Thor himself a bit underwhelming again though. I just expect something more imposing as the good of thunder. But then I’m Scandinavian so…

Anyway, this was a great film. I enjoyed it very much.",824,2018-01-22 06:06:56,2024-05-16 15:21:16
182,90,Review from tmdb44006625,"One of the few movies to actually make me feel like a kid again, Joss Whedon was the perfect filmmaker to do this film. Everyone gets their time to shine. The script juggles every plot point and character moment with clarity and ease. It's funny, smart, and visually jaw dropping. Definitely lived up to the five movie hype.",719,2019-03-09 20:50:01,2021-06-23 15:58:19
183,91,Review from E.J. Cummings,"I give this 10 Stars based on it being not only better than the trailer and the hype made me thing it would be, but also that it was the first time anything the size and scope of the Marvel Cinematic universe was pulled off successfully. Having Joss direct this movie lives and dies on character interaction. This movie is on the definitive list in my opinion even just for that.",50,2019-04-09 22:11:02,2021-06-23 15:58:20
184,37,Review from John Chard,"Everything that's happening, the things that are about to come to light, people might just need a little old fashioned.

The Avengers (AKA: Avengers Assemble) is written and directed by Joss Whedon, with Zak Penn co-writing the story. It stars Robert Downey Junior, Chris Evans, Mark Ruffalo, Chris Hemsworth, Scarlett Johansson, Jeremy Renner, Tom Hiddlestone, Clark Gregg, Samuel L. Jackson, Cobie Smulders and Stellan Skarsgard. Music is scored by Alan Silvestri and cinematography by Seamus McGarvey.

Asgardian outcast Loki (Hiddlestone) has struck a deal with the Chitauri to exchange the Tesseract for an army with which he can attack Earth and thus control it. With the Earth in mortal danger, S.H.I.E.L.D director Nick Fury (Jackson) activates the Avengers Initiative; a collection of super heroes and deadly assassins who, if they can actually come together as one united force, hold the fate of the Earth in their hands.

I have no real frame of reference with The Avengers comic book world, when I was young I read a bit of Spidey, Batman and was kind of partial to The Fantastic Four, but I really don't remember story lines and gave up reading that sort of stuff once sport and exams came into my life. I love movies and as I enter the later stages of my forties I'm pleased to say I have a wide range of film genre interests. I have very much enjoyed The Avengers solo films so far, with the exception of Iron Man 2 which quite frankly is average at best, but the reality is that if The Avengers failed as a movie, that Whedon got it so wrong, then I wouldn't be foaming at the mouth or proclaiming that the director be stripped naked and whipped around the streets of Hollywood! As it is, with one or two minor irks aside, The Avengers is about as much fun as I have had with a movie in quite a few years.

I wouldn't know if the makers got the essence right, or if the story is at one in the Marvel Avengers Universe, I just know that it is a right old blast and made a colossal amount of money at the box office, even trumping The Dark Knight Rises in that department. It's a film full of derring-do heroics, ripe witticisms, wonderfully staged action, simmering sexual tensions, ego collisions, charm, heart and splendid human interactions. It looks fabulous on Blu-ray, the art design, the colour photography and Silvestri's score rumbles like thunder and crackles like lightning, just as a super hero movie score should do. The cast performances are hugely enjoyable as they bounce off of one and other, feeding off the respective thespian energy with a knowing of the right tone to make this colourful comic book world be all that it can be. While Whedon, with a weight of expectation akin to Atlas holding the World on his shoulders, comes through with flying colours with astute pacing and an impressive marshaling of an acting army.

Flaws? Jackson's Nick Fury could have done with more screen time and Cobie Smulders is sadly short changed as well. The Chitauri are only really a threat because of their sheer numbers, not because of any great alien design, and, well, The Hulk CGI hasn't really advanced much from the 2008 version, but really these are small itches rather than big ones. Is The Avengers the best film of 2012? It will be seen as such for many fans of the source(s) who have waited with baited breath for this coming together of their heroes, and that notion really shouldn't irk the more highbrow film fans out there. Me? No it isn't the best film of 2012, but as I found my self perched on the edge of my seat as the finale unfurls in a wave of explosive heroic energy, and I caressed my ribs from laughing out loud, I knew then that undoubtedly The Avengers is the most fun film of 2012. 9/10",335,2019-08-04 12:28:04,2024-05-16 15:22:24
185,92,Review from Justin Lopez,"The Avengers is a dream movie come true for superhero fans with its group of extremely talented actors and epic champions, to create an action- packed movie with hilarious banter laced in between scenes. I love how each of the actors and actresses has portrayed each of the roles they were given.",393,2019-11-06 20:38:07,2021-06-23 15:58:28
186,93,Review from LoganWright,"Definitely the greatest superhero movie of all time. Marvel has set the bar high with this one and so far, they're doing a good job of keeping up with that despite not being able to raise it higher!",44,2019-11-07 03:05:23,2021-06-23 15:58:28
187,94,Review from BradleyStewart,I found it creative of Marvel to introduce each character one by one. It really set the tone and had me looking forward to what's gonna happen.,775,2019-11-07 03:44:09,2021-06-23 15:58:28
188,95,Review from Jane Hall,Perfect casting! You can really see and feel that the actors have great chemistry both in and out of their characters.,920,2019-11-07 04:10:37,2021-06-23 15:58:28
