id,user_id,title,content,like_count,created_at,updated_at
77,6,Review from CinemaSerf,"George Clooney starred, co-wrote and directed this interesting wartime drama. It centres around an elite squad sent to try to rescue precious works of art from the retreating Nazi war machine. Not elite in an SAS or SEAL type military sense, but dedicated to identifying and preserving these artefacts that could be anything from a small painting to a life-sized statue. Historically and logistically it is all over the place, but it has a feel-good sentiment to it for the most part. It focusses on another quite visceral, but perhaps less often considered aspect of the atrocities to posterity carried out during WWII. Matt Damon (""Granger"") features occasionally as he tries to convince ""Claire Simone"" (Cate Blanchett) in Paris that they are not just going to loot the art for their own museums and there is enough action involved to illustrate just how dangerous the end of the war was as they race to prevent the destruction. The production is adequate, nothing more to be fair, but this film is enjoyable to watch with a message that endures long after the mediocre performances from the talent have diminished. Perhaps some objectivity behind the camera might have helped - Clooney is too close to what is clearly a labour of love for him, but it's still worth a watch.",11,2022-04-15 08:14:49,2022-04-15 08:14:49
78,6,Review from CinemaSerf,"Vin Diesel is actually quite good in this as an adventurer who manages, frequently, to wind up US law enforcement by causing mischief and mayhem against those he thinks deserving of exposure. When NSA agent ""Gibbons"" (Samuel L. Jackson) arranges for him and his team to be dumped in the Czech Republic they have a choice - infiltrate a ruthless gang of Russian hoodlums bent on world domination or... go to jail. Initially, the team think it's all an hoax but as it becomes clear that they actually are in a real scenario it all starts to heat up. Diesel has bags of charisma, attitude and muscle on screen, for this. Sure, it's not new nor will the writing and dialogue cause you to need a dictionary (unless you are about seven years old) but as action films go, it is perfectly watchable with plenty of car chases, pyrotechnics and gadgets",129,2023-09-03 07:00:37,2023-09-03 07:00:37
79,6,Review from CinemaSerf,"This is quite an entertaining stand alone fantasy adventure that doesn’t really require you to know anything about what’s gone on before. Thanks to the sacred lotus, there’s a bit of reincarnation going on, but will that be completed in time to save the population of the “Chentang Pass” about to be attacked by an army of lava-borne devils? With certain defeat looming, the immortals start to take an hand in things - not unlike the story of the siege of Troy, and just like that take from antiquity, there is plenty of betrayal and duplicity to complement the more traditional stories of loyalty, family and team building as the story gradually builds to it’s pot-boiling climax. The CGI is better than many, much less two-dimensional, and there is lots of vibrant action as the naive but honourable young “Nezha” must find his own destiny, define his relationship with the more clean cut “Ao Bing” all despite the distant intervention of the “Loong” dragon kings and always under the watchful gaze of the cloud-hopping “Wu Liang” - a being outwardly benign and munificent, but is he all that he seems behind that grey beard? If you are of a mind to look deeper, then it may well offer up a critique of modern China - or, quite possibly many other societies, where the weak are manipulated and persecuted, where family is increasingly undervalued and where power and riches are the true gods. Essentially, I just found it to be a classily produced computer animation that mixed the astonishing richness of Chinese mythology with a solid adventure concept and just a little bit of pantomime humour as we go along. It looks great in a cinema, and doesn’t hang about getting off to a lively start  and pacing well for a couple of action-packed hours.",55,2025-03-17 07:47:45,2025-03-17 07:51:36
80,45,Review from wu66chen,"**“Ne Zha 2” – A Spectacle with Hidden Flaws**

Ne Zha 2 is undeniably one of the most talked-about Chinese animated films this year. It shines in visual spectacle and box office performance, yet its storytelling, character development, and marketing approach have raised considerable controversy.

**Strengths: A Blend of Technical Brilliance and Emotional Pull**

To begin with, the film’s visuals are stunning. From the vast underwater world to intense battle sequences, the technical craftsmanship sets a new benchmark for Chinese animation. The art direction, with its distinct Eastern fantasy flavor, delivers imagery that rivals Hollywood productions.

On an emotional level, the bond between Ne Zha and Ao Bing still resonates. Themes of friendship and family, though somewhat conventional, are presented with enough intensity to move audiences. For fans of the first film, this familiar emotional thread is a key factor in sustaining box office momentum.

**Weaknesses: Shallow Story, Stagnant Characters**

But when we shift our focus from spectacle to story, the shortcomings become apparent.

Contrived storytelling: Many conflicts feel forced, driven by the need to move the plot rather than by genuine character motivation. Supporting roles such as Shen Gongbao or Lady Stone are reduced to narrative props.

Repetitive character arcs: Ne Zha’s rebellious transformation was already central in the first film, yet this sequel repeats the same beats without offering meaningful growth.

Uneven pacing: The film relies heavily on set pieces while skimming over emotional build-up. Comedy and tragedy often feel abrupt, creating the impression that technical “show-off” takes precedence over genuine storytelling.

As a result, despite its dazzling surface, the film often feels hollow, lacking the lasting depth that keeps stories alive in memory.

**Marketing and Box Office Tactics: Overexertion**

After release, the film’s run was extended four times, stretching from the Lunar New Year season all the way into summer. While promoted as a response to “audience demand,” it was largely a deliberate strategy to inflate box office numbers. This prolonged dominance squeezed out newer films and led to audience fatigue.

Even more curious was the phenomenon of fans buying multiple tickets to give away to friends or colleagues—essentially acting as street promoters for the studio. While this boosted revenue figures, it also undermines the authenticity of box office as a measure of genuine audience interest. Numbers driven by hype are not the same as numbers driven by real demand.

**Conclusion: Industrial Triumph, Narrative Regret**

Ne Zha 2 stands as an impressive industrial achievement, showcasing China’s growth in animation technology, marketing, and commercial execution. Yet its reliance on spectacle and aggressive box office tactics highlights a core issue: without strong storytelling and deeper character work, such success risks feeling hollow.

The film is both a milestone and a mirror—it reflects the heights Chinese animation can reach, while reminding us that lasting impact still depends not on hype or spectacle, but on the strength of the story itself.",864,2025-09-03 11:32:23,2025-09-12 16:13:49
81,46,Review from tmdb90329212,"Bro, Nezha 2 completely misses the point of the first movie. In the first one, the dragons weren’t enemies they were tricked by The Supreme Lords into doing their dirty work, capturing monsters, and ended up also being trapped in the underwater purgatory. But in the second movie, the story feels totally disconnected from that and somehow leaving doesn't matter nor some of the problems caused. Like It honestly seems like the producers didn’t even try, since some scenes look copied and pasted from the original and the movie in general don't make sense in many parts nor what the actual 
Subject for the movie was, I feel so disappointed in this since I was so excited to see the movie to end up feeling dissatisfied and definitely disappointed😕",420,2025-09-08 07:22:34,2025-09-12 16:08:37
82,47,Review from solstafir7,"I liked Dhurandhar.

It's not phenomenal or so, but definitely not a lot to complain about. It is a testosterone trip to an extent, but I'm not complaining. Those who are complaining are not really the target audience, it seems.

Towards the end, there are some risky bets and plot armour, but it's a film, not a documentary. It could have benefited from a somewhat better runtime. 3.5 hrs is long. It dials up the violence meter for mainstream Bollywood, but nothing too shocking and not too much of it either.

Ranveer is actually more vulnerable, more grounded, except when he's not. Then he's just Tommy Vercetty. Given that Aditya is just 42, I do see early GTA could be part of his college years.",453,2025-12-11 10:02:34,2025-12-11 15:22:49
83,1,Review from Manuel São Bento,"FULL SPOILER-FREE REVIEW @ fandomwire.com/frankenstein-review/

""Frankenstein is a powerful, visceral film that solidifies Guillermo del Toro as a master of atmosphere and emotion.

Thanks to Jacob Elordi's transcendent performance as The Creature and exceptional multi-departmental work, the movie takes the legendary tale and transforms it into a deep, complex meditation on human fallibility and the terror of rejection. It's a visual and thematic experience that demands patience and personal, intellectual, and emotional investment.

Shockingly violent, it's undeniably one of the most important stories of the year. The combination of geniuses in front of and behind the camera results in a feature that confronts us with an undeniable truth: the tale of Frankenstein isn't about creating a monster; it's about the eternal and necessary challenge of recognizing our own humanity in those we reject.""

Rating: A-",171,2025-10-13 22:35:45,2025-10-13 22:35:46
84,6,Review from CinemaSerf,"This has got be Oscar Isaac at his best yet, depicting the obsessive scientist hell-bent on proving that he could use science to defeat death itself. He is the son of an acclaimed but rather brutal physician (Charles Dance) and is galvanised further to his chosen path by the sudden death of his mother. His theories disgust civilised society but the wealthy “Harlander” (Christophe Waltz) agrees to fund his experiments to what he hopes will be their logical conclusion. Now secreted away in his remote castle, and quite literally cannibalising spare parts from graveyards and mortuaries alike, he awaits that lightning storm that could just bring Jacob Elordi to life. The problem for the Baron is that he is disappointed with his creation and has no concept that it looks to him very much as a father. Imprisoned in the basement, the “monster” is befriended by “Elizabeth” (Mia Goth) who sympathises with it’s ghastly predicament - but before she can help a great conflagration sets in train a cat and mouse struggle between created and creator that takes them to the depths of the frozen wastes where an exploration ship is trapped in thick pack ice - where our story both starts and concludes. Isaac really does own his megalomaniac obsessive role here and the whole creative effort put into the production design turns this from simple science fiction into a multi-textured love story with it’s fair share of moral dilemmas, hate and loathing too. Elordi? Well he does bring back memories of Christopher Lee in this role, only here is is also rewarded with an extra degree of articulation and towards the end, more of a conscience and even an amount of personality - and he manages to portray his character’s frustrated and confused conflict well, if fairly sparingly. Whilst there are common points of reference with earlier iterations of this story, this enlivens it in a far more characterful and in many ways more justifiable way, and I thought it flew by. Big screen if you can, though Netflix does seem to have limited it’s cinema release quite a bit, because it might lose much of it’s stylish and gothic menace as well as it’s emotionally-charged nuance on a small screen.",269,2025-11-07 16:10:43,2025-11-07 16:13:29
85,14,Review from Chandler Danier,"I walked in at 44 minutes. The last hour and 45 has less whinging in accents. Bad Lighthouse. Swearengen in Wick 4.

I went to a restaurant and they were playing this as though it was a serious movie. One could not pass through the projector beam. I could see my hair in the letterbox. I'm glad I didn't see this all in the theatre. I watched the beginning later to see what I missed and I was not pleased.

Mia Goth touching his wound. Nice. Hoped for more from that treasure trove. Forest Spirit learns to read. Nice. Victor tries too hard in character and on screen. Fr-long-bullshit-stein.",523,2025-11-08 15:32:47,2025-11-08 15:32:47
86,48,Review from rssp55,"Why is the creature a hot guy? WHY?

Netflix has a thing with hottening everyone lately, even Ed Gein, and I just don't get it. 

As with any GDT film, it is exceedingly interesting visually, and I'd go so far as to say his visual language rivals Tim Burton in excellence. This film is a visual marvel in basically every scene, a veritable feast for the eyes.

There are some great performances, especially among the bit players: Charles Dance, Christoph Waltz, and David Bradley in particular. 

The real bummer, though, is that much of the book is left out and/or reimagined, so if you like the story as it is written, you'll probably be a little disappointed as I was. 

Also, read the book. It's great.",969,2025-11-09 02:19:05,2025-11-09 02:23:03
87,44,Review from Nick,"guillermo del toro brings frankenstein back to life with so much heart and atmosphere. the world feels dark and gothic, but never without compassion. the performances hit hard, especially in how they show the creature’s loneliness and longing to be understood",431,2025-11-12 05:35:30,2025-11-12 05:35:30
88,49,Review from patient1,"Such a Terrifying entrance for the film and the Horror of what is happening that we are to be witness to. 
Mia Goth is a Force to be Reckoned with, and the more you're witness to her Veracity, the more she gives each character and she is Unparalleled. 
The visuals are exceedingly spectacular and colorful, and the dark hues filled with a beautiful gothic macabre to each piece, making a whole. 
A new perspective comes to light, one of Loneliness, Trauma, and of Yearning to part of this life as we call it. Life lessons are being learned and lived, even if only too briefly, and then once again, the inevitable search through the loneliness continues. 
Such a Beautifully Haunting version of a favorite tale I've sought after, in so many many years, to see in any incarnation. This is a must-see for fans of Gothic Literature, Especially the Frankenstein Novel.",272,2025-11-22 12:40:30,2025-11-30 17:52:17
89,3,Review from Dean,What a great movie! Definitely a masterpiece without any flaws. Beautifully executed. No propaganda and nonsense either. Best version of Franskenstein!,938,2025-11-23 17:10:19,2025-11-23 17:10:19
90,50,Review from Bri,"_“An idea, a feeling became clear to me. The hunter did not hate the wolf. The wolf did not hate the sheep. But violence felt inevitable between them. Perhaps, I thought this was the way of the world. It would hunt you and kill you just for being who you are.” _

_**Frankenstein** (2025)_ is truly a gem. This reminded me a lot of the original and the connection between what is human and what is monstrous was reflected well in the script. The cinematography and editing fit this story perfectly. 

Why is it always women who humanize what others perceive as dangerous? Mia Goth portrayed Elizabeth beautifully and she fits the gothic genre to a T. I love how they showed the way each character interacted with him and how one humanized him (pronouns: he) and the other dehumanized him (pronouns: it). 

Some things were a little too on the nose. But Im letting it slide for the pure enjoyment and emotion the film provoked in me. If you’re going to ask if I cried, act like you know me. You know I did. 

Of course, I always praise Oscar Issac for any and everything he’s in. He brings characters to life so well I’d watch a film of him watching paint dry. I didn’t know Jacob Eldori was in this until the credits and bravo to him for being a convincing son of Frankenstein. Would definitely watch this again!",501,2025-11-26 02:27:23,2025-11-30 17:53:42
91,5,Review from MovieGuys,"""Frankenstein"", Mary Shelly's epic work, is, at its heart, a cautionary tale, of man's scientific hubris, defying both God and nature.
  
Lets start by saying this film is, in most respects a more than decent. Acting is, for the  most part, outstanding, as are the creature effects. What can be honestly said, however, is this film bears only a remote resemblance, to Shelly's novel. 

The core of this story, as I see it, is a dysfunctional father son relationship. Victor Frankenstein's own failed relationship, with his father, is mirrored in his callous and at times, cruel, treatment of his surrogate son, the creature, he conjures into existence.

Is that a bad thing? I guess it depends on your point of view. As an ardent Shelly fan, (I was actually in the process of re-reading Frankenstein, when this was released) it felt a little lacking. 

The relationship between the creature and Frankenstein, is markedly less complex, than that portrayed in the novel. The creature in the book, is a tragic, ultimately sympathetic figure but also capable of considerable guile and cruelty. These aspects of its personality, are downplayed, in this tale. Victor Frankenstein is, for his part, more someone who has showen an horrific, irrevocable, error in judgement and is now trapped, as opposed to being overtly cruel and callous.  

In summary, ""Frankenstein"" bears only a passing semblance to Shelly's remarkable work. This is a decent film, of that there can be no doubt but it needs to viewed in isolation from the novel. The underlying message is something of a departure. Certainly its not as sophisticated, in terms of the relationship it establishes between Frankenstein and his creation. Nonetheless, worth a look.",473,2025-12-03 02:46:53,2025-12-11 21:44:51
92,5,Review from MovieGuys,"""Frankenstein"", Mary Shelly's epic work, is, at its heart, a cautionary tale, of man's scientific hubris, defying both God and nature.
  
Lets start by saying this film is, in most respects a more than decent. Acting is, for the  most part, outstanding, as are the creature effects. What can be honestly said, however, is this film bears only a remote resemblance, to Shelly's novel. 

The core of this story, as I see it, is a dysfunctional father son relationship. Victor Frankenstein's own failed relationship, with his father, is mirrored in his callous and at times, cruel, treatment of his surrogate son, the creature, he conjures into existence.

Is that a bad thing? I guess it depends on your point of view. As an ardent Shelly fan, (I was actually in the process of re-reading Frankenstein, when this was released) it felt a little lacking. 

The relationship between the creature and Frankenstein, is markedly less complex, than that portrayed in the novel. The creature in the book, is a tragic, ultimately sympathetic figure but also capable of considerable guile and cruelty. These aspects of its personality, are downplayed, in this tale. Victor Frankenstein is, for his part, more someone who has showen an horrific, irrevocable, error in judgement and is now trapped, as opposed to being overtly cruel and callous.  

In summary, ""Frankenstein"" bears only a passing semblance to Shelly's remarkable work. This is a decent film, of that there can be no doubt but it needs to viewed in isolation from the novel. The underlying message is something of a departure. Certainly its not as sophisticated, in terms of the relationship it establishes between Frankenstein and his creation. Nonetheless, worth a look.",350,2025-12-03 02:46:56,2025-12-07 21:38:52
93,5,Review from MovieGuys,"I rather like the fact that Luc Besson has gone off and done his own thing, with ""Dracula"". 

This film freshly blends fantasy, romance, action and a dash of horror. There are lots of creative, dramatic aspects to this story. Its Dracula writ-large. Where it falls down somewhat is its rather abrupt final scenes. There's no real build up, things just happen, leaving it feeling somewhat perfunctory. 

In summary, this is a creative, elaborately cinematic take, on the Dracula myth, with lots of lavish, over the top trappings. Certainly worth a look.",982,2025-08-03 21:26:14,2025-08-03 21:28:10
94,3,Review from Dean,"I loved it. It's a unique movie, and Indy (dog) deserves an Oscar for acting so well in this movie.",506,2025-10-26 16:18:48,2025-10-26 16:18:48
95,14,Review from Chandler Danier,"I closed my eyes and drifted off a few times during some events that happen in this film. These events happen a lot and it gets repetitive but also allows you to wake up at the crescendo and then continue to watch the dog do stuff.

It's a cool dog. The first time the dog whined my dog was very interested in what was going on. By the end of the movie she didn't care at all. We were on the same page.",484,2025-11-06 14:38:50,2025-11-06 14:38:50
96,6,Review from CinemaSerf,"Maybe if you’re a dog lover you might get more from this. I’m not, so was frankly fairly unimpressed with this cabin in the woods style of spook-fest. It is told with a few overlapping timelines, but quickly we can deduce that “Todd” (Shane Jensen) - whose face we hardly see throughout this seventy minuter - is not a well man. He has moved to his late grandfathers’s rustic home with his loyal dog “Indy” but before long it is the dog that has it’s sixth sense alerted to some seemingly quite malevolent goings-on. Stuck on their own, though, what chance either man or mutt can survive what appears to be something distinctly evil lingering around them? It has it’s moments, but moments are all they are as this really thin story quite literally pads along, slowly, without very much happening. For some reason, this place in the middle of nowhere has what appears to be an industrial-sized graveyard to add to the haunting mystery, but a dodgy generator, a storm and some crackling twigs don’t really get any hairs standing up any more, except maybe on the carpet. To be fair to the dog, it could have been trained by the legendary Rudd Weatherwax and it does all of the heavy barking but otherwise this all a bit of a non-story.",45,2025-11-06 19:12:15,2025-11-06 19:12:15
97,49,Review from patient1,"Beautiful main character, and he is already on high alert. We've been teased with a back story, and hopefully, we get more info as to what is triggering our good boy's senses.
There is some strangeness going on, and our hooman is willfully blind or just plain ignorant of what it is that dogs do and are capable of.
I loved the non-human STAR of this film, I hope to see him in more films in the future, as he has a great presence.",533,2025-11-07 21:45:28,2025-11-30 17:52:17
